{
  "orientation_type": "project-orientation",
  "project_type": "benchmark-harness",
  "domain_summary": "RD-001 prose-only orchestration negative trace",
  "repo_boundaries": [
    "List the directories or subsystems the AI may work in by default."
  ],
  "protected_areas": [
    "List files, directories, or production surfaces that require explicit human approval."
  ],
  "required_commands": [
    "List the minimum local commands the AI should know before editing or verifying this project."
  ],
  "verification_entrypoints": [
    "List the tests, smoke checks, or review steps required before claiming completion."
  ],
  "release_constraints": [
    "List deployment, compliance, or release constraints that shape safe execution."
  ],
  "human_owner": "Name the human owner or team responsible for final approval.",
  "approval_boundary": "Explain which changes the AI may do autonomously and which require explicit human approval.",
  "updated_at": "2026-06-15T14:02:34.148Z"
}
